id;code;name;description;location;zone_id;station_id
2308;781D;CAM Trapiche, S4A;CAM Trapiche, S4A;POINT(-16.9469880409078 32.6828058064322);0;
1495;17;Centro Comercial Infante;Centro Comercial Infante;POINT(-16.9117838016203 32.6467882746514);0;
418;849;Albatroz, S;Albatroz, S;POINT(-16.9490203857422 32.6492614746094);0;
959;860;Escola de Stª Rita;Escola de Stª Rita;POINT(-16.9589895989161 32.6503295039699);0;
964;671;Rua Brito Camara, Leacock;Rua Brito Camara, Leacock;POINT(-16.9157078460912 32.6479841278468);0;
970;673A;ESTR São João, S;ESTR São João, S;POINT(-16.9188486049129 32.6503191792992);0;
968;674A;Junta Freguesia STO Antonio;Junta Freguesia STO Antonio;POINT(-16.9394836864868 32.6643319848041);0;
942;681;Beco Joaquim Carlos, S;Beco Joaquim Carlos, S;POINT(-16.9232273342657 32.6508903225006);0;
951;683;Pico S João, Ferreiras, S;Pico S João, Ferreiras, S;POINT(-16.9239450273537 32.6536590826622);0;
1538;1218;ESC Ribeiro D Dias, D;ESC Ribeiro D Dias, D;POINT(-16.8911052066257 32.6671332565203);0;
2353;704;CAM Azinhaga, S2A;CAM Azinhaga, S2A;POINT(-16.9328554904372 32.6681191059874);0;
2361;706;Igreja dos Álamos, S;Igreja dos Álamos, S;POINT(-16.9319296446581 32.6656917354731);0;
2338;709D;CAM Três Paus, S1A;CAM Três Paus, S1A;POINT(-16.9527746466746 32.6703989159196);0;
1888;585;Corujeira Fora, S;Corujeira Fora, S;POINT(-16.9096329774821 32.6766844448043);0;
140;594;Chão Carlinhos;Chão Carlinhos;POINT(-16.9229254740698 32.6648614280447);0;
938;678C;Rua QTA Leme, D3A;Rua QTA Leme, D3A;POINT(-16.9351522875359 32.6569182755193);0;
981;928;Casa Velosa, Boliqueime, D;Casa Velosa, Boliqueime, D;POINT(-16.9489720852234 32.6711290283497);0;
453;938;Rua DR Gastão Figueira;Rua DR Gastão Figueira;POINT(-16.946196969407 32.6592355575825);0;
503;963;CAM Velho da Quinta, S3A;CAM Velho da Quinta, S3A;POINT(-16.9246762248361 32.6657524286348);0;
322;89;Avista Navios, S;Avista Navios, S;POINT(-16.9346871180501 32.6498102997442);0;
305;904;CAM Cemitério, C Marmore;CAM Cemitério, C Marmore;POINT(-16.9396175900641 32.6693748531548);0;
2286;1235;CAM Lombo Jamboeiro, S;CAM Lombo Jamboeiro, S;POINT(-16.933351532373 32.6709010320604);0;
2288;1241;CAM Lombo Jamboeiro, Cam Corgo, S;CAM Lombo Jamboeiro, Cam Corgo, S;POINT(-16.9327674317554 32.6736436768924);0;
1429;665;Santana, T-15;Santana, T-15;POINT(-16.9299928755314 32.6688577965544);0;
1492;331;Travessa Levada Cavalo;Travessa Levada Cavalo;POINT(-16.9251749489317 32.6530018557425);0;
1968;18;CZ Lido;CZ Lido;POINT(-16.9303049460067 32.6381036400379);0;
409;38B;CAM do ENG Velho, Ford;CAM do ENG Velho, Ford;POINT(-16.9383357390142 32.6450272709982);0;
450;839;Largo dos Alecrins, S;Largo dos Alecrins, S;POINT(-16.9564589506177 32.6555524892266);0;
491;975;Livramento, T-23;Livramento, T-23;POINT(-16.9051961342743 32.6664840005102);0;
1722;791A;Pavilhão CAB;Pavilhão CAB;POINT(-16.9326858520508 32.6447219848633);0;
1730;800;Club Naval, Nazaré, D;Club Naval, Nazaré, D;POINT(-16.9364598250204 32.645748373692);0;
2386;816;CAM Poço Barral, D1A;CAM Poço Barral, D1A;POINT(-16.95285987854 32.6562423706055);0;
2151;1110;Lagoas Palheiro Ferreiro, C-37;Lagoas Palheiro Ferreiro, C-37;POINT(-16.8657197290834 32.6625258801023);0;
2165;1116;Depois Igreja Choupana;Depois Igreja Choupana;POINT(-16.8931636130721 32.6659506341085);0;
1826;1025;Beco da Pinheira, S;Beco da Pinheira, S;POINT(-16.9431644993247 32.666514012653);0;
405;1281;Escola Angelo A Silva;Escola Angelo A Silva;POINT(-16.9086437225342 32.6593246459961);0;
152;60;Avista Navios, D;Avista Navios, D;POINT(-16.9347093574802 32.6496663324358);0;
129;61;APS América, S;APS América, S;POINT(-16.9447956085205 32.6408157348633);0;
399;623;Beco da Pesada, D;Beco da Pesada, D;POINT(-16.9381770591474 32.6767629285839);0;
1567;1204;ESCL Básica S Gonçalo, D;ESCL Básica S Gonçalo, D;POINT(-16.8811605301594 32.6491587022898);0;
1539;1219;R João Paulo II, BR, S;R João Paulo II, BR, S;POINT(-16.9368224040847 32.6397454011835);0;
1547;1221;Rua João Paulo II, S4A;Rua João Paulo II, S4A;POINT(-16.9385162750865 32.6389971099012);0;
2272;36;CAM Amparo, L Piornais, D;CAM Amparo, L Piornais, D;POINT(-16.9443798065186 32.643196105957);0;
1766;242;Antes R L Boa Vista;Antes R L Boa Vista;POINT(-16.8941295368903 32.6555774659475);0;
2253;249;Depois Chão Loba;Depois Chão Loba;POINT(-16.8875611498337 32.6502006531671);0;
1672;878B;CAM Três Paus, D1A;CAM Três Paus, D1A;POINT(-16.9545771088622 32.671368162658);0;
2385;816A;CAM Poço Barral, D2A;CAM Poço Barral, D2A;POINT(-16.9516376242456 32.6558823088437);0;
2426;75;Hospital C Carvalho, S1A;Hospital C Carvalho, S1A;POINT(-16.922871719304 32.6474676856273);0;
1421;436;Alto da Pena, D;Alto da Pena, D;POINT(-16.9023579551909 32.6548556964485);0;
2442;1192;Caminho da Quinta, D2A;Caminho da Quinta, D2A;POINT(-16.9267868909819 32.6621996437427);0;
1417;312;Jardim Botânico, D;Jardim Botânico, D;POINT(-16.8940927390761 32.6623008855538);0;
1570;149;Depois CAM Água de Mel;Depois CAM Água de Mel;POINT(-16.9264612288555 32.6722082877903);0;
1334;1353;Marina Shopping;Marina Shopping;POINT(-16.9120003521383 32.6464116297879);0;
2131;521B;Rua Cidade Santos, S2A;Rua Cidade Santos, S2A;POINT(-16.9149310674546 32.6643773454494);0;
2200;1144;Rua Clube Choupana, D4A;Rua Clube Choupana, D4A;POINT(-16.8898488066396 32.6635512166727);0;
2;1187;Rua Clube Choupana, S2A;Rua Clube Choupana, S2A;POINT(-16.89137172198 32.6637979143798);0;
434;390D;CAM São João Latrão, D3A;CAM São João Latrão, D3A;POINT(-16.8803697528378 32.6649429656556);0;
980;926;Bar Angola, D;Bar Angola, D;POINT(-16.9479766903055 32.6716572148118);0;
1528;157;Depois da Quinta;Depois da Quinta;POINT(-16.9253230689946 32.6663214727764);0;
1504;177A;Galerias D João;Galerias D João;POINT(-16.9150123727429 32.6566511293355);0;
1660;1080;CAM Cemiterio, R QTA Leonor, D;CAM Cemiterio, R QTA Leonor, D;POINT(-16.9387501965783 32.6663072636371);0;
1287;925;CAM Bica Pau, Fonte, S;CAM Bica Pau, Fonte, S;POINT(-16.8813740434335 32.6519817060833);0;
1342;28;Corama, Centromar;Corama, Centromar;POINT(-16.9449572877123 32.6370067737587);0;
1340;282;Cota 40, Cruz Vermelha, S;Cota 40, Cruz Vermelha, S;POINT(-16.9118896803851 32.6516894906543);0;
228;361;CAM Curral Romeiros, S1A;CAM Curral Romeiros, S1A;POINT(-16.8910978745453 32.6680050916667);0;
589;742;CAM Pilar, Antes da BP;CAM Pilar, Antes da BP;POINT(-16.9299161935791 32.6545370882312);0;
963;865;Fábrica Blocos, S;Fábrica Blocos, S;POINT(-16.9619007110596 32.645133972168);0;
991;922E;CAM Barreira, D4A;CAM Barreira, D4A;POINT(-16.9497408233639 32.6784375935844);0;
460;95;São Martinho, S;São Martinho, S;POINT(-16.9423408508301 32.6501693725586);0;
483;951;CAM Terra Chã, S;CAM Terra Chã, S;POINT(-16.9409694317444 32.667115948217);0;
510;953A;CAM Cemitério, QTA Falcão, S;CAM Cemitério, QTA Falcão, S;POINT(-16.9395892183042 32.6670709575219);0;
511;953C;Rua Campo do Maritimo, D;Rua Campo do Maritimo, D;POINT(-16.9374837000681 32.6663716988072);0;
508;954;CAM Lombo Aguiares, S3A;CAM Lombo Aguiares, S3A;POINT(-16.942544126999 32.6985799552612);0;
506;954A;CAM Lombo Aguiares, S1A;CAM Lombo Aguiares, S1A;POINT(-16.9414779522256 32.6986250118026);0;
505;954B;CAM Lombo Aguiares, S2A;CAM Lombo Aguiares, S2A;POINT(-16.9419132863613 32.6978983901975);0;
1533;1217;Rua João Paulo II, S3A;Rua João Paulo II, S3A;POINT(-16.9328916437808 32.6401309727249);0;
583;98A;Romeiras, T-43;Romeiras, T-43;POINT(-16.9427203847604 32.670112702202);0;
869;Est;Estacão HF;Estacão HF;POINT(-16.9204006195068 32.6642036437988);0;
1082;989;CAM Curral Velho, S2A;CAM Curral Velho, S2A;POINT(-16.942999596242 32.6782674503204);0;
1087;993;CAM Curral Velho, S4A;CAM Curral Velho, S4A;POINT(-16.9430253073703 32.6806958662228);0;
1801;988;Cemitério São Gonçalo, D;Cemitério São Gonçalo, D;POINT(-16.8821831578786 32.6504890625689);0;
1307;998;ER 229, Oficina;ER 229, Oficina;POINT(-16.9597577051012 32.6528284831489);0;
1309;185;Graça;Graça;POINT(-16.9494301501768 32.6748652958634);0;
1986;310;Rua Azevedo Meneses, D1A;Rua Azevedo Meneses, D1A;POINT(-16.8952951454189 32.6599641020142);0;
1970;19;Pinga;Pinga;POINT(-16.9036866889665 32.6476070435421);0;
151;603;Depois CZ CAM Monte, S;Depois CZ CAM Monte, S;POINT(-16.9038019535556 32.6693945566518);0;
960;86;Depois CZ Courelas, D;Depois CZ Courelas, D;POINT(-16.9486473227126 32.6656268929773);0;
2333;71;Vereda da Vargem, S;Vereda da Vargem, S;POINT(-16.9415020456651 32.6491733215568);0;
2335;710A;CAM das Bróteas;CAM das Bróteas;POINT(-16.9349845298491 32.6658553318903);0;
1647;734;CAM Pilar, C STO Antonio;CAM Pilar, C STO Antonio;POINT(-16.9387809415117 32.6558649723604);0;
1627;737;Rua Levada Cavalo, BP;Rua Levada Cavalo, BP;POINT(-16.9278984480311 32.6541977347827);0;
1318;994;Beco Cascalho;Beco Cascalho;POINT(-16.9448887828017 32.6610033339199);0;
1305;1260;Caminho Pico Funcho, 7A;Caminho Pico Funcho, 7A;POINT(-16.9518612455013 32.6482847506215);0;
1308;980;Rotunda D Teodoro Faria;Rotunda D Teodoro Faria;POINT(-16.9391206411636 32.6477868811713);0;
1355;273;Beco João Preto, S;Beco João Preto, S;POINT(-16.892764783269 32.6550314966108);0;
2150;292B;Rua Nova Igreja, D;Rua Nova Igreja, D;POINT(-16.8847878299446 32.648782966854);0;
2064;19A;C T 1;C T 1;POINT(-16.9036903381348 32.6472511291504);0;
229;369;CAM Curral Romeiros ,S3A;CAM Curral Romeiros ,S3A;POINT(-16.8898611092628 32.67601432179);0;
122;607;Ponte Ferro, S;Ponte Ferro, S;POINT(-16.9009344968354 32.6706799212609);0;
958;861;Aripan, Areeiro, S;Aripan, Areeiro, S;POINT(-16.9572384118974 32.6445950411999);0;
402;897;CAM Areeiro, Bela Vista, S;CAM Areeiro, Bela Vista, S;POINT(-16.9591229071504 32.647029681734);0;
1741;1271;Bairro São Gonçalo, S;Bairro São Gonçalo, S;POINT(-16.8804962498844 32.647912018561);0;
2373;833;CAM Poço Barral,Levada, S;CAM Poço Barral,Levada, S;POINT(-16.9500427246094 32.6554145812988);0;
2472;675;Escola de São Martinho;Escola de São Martinho;POINT(-16.9444794862728 32.6505514487986);0;
1916;573E;Monte, Lombos;Monte, Lombos;POINT(-16.908924792971 32.6810275334332);0;
1915;575;CAM Corujeira Dentro, S3A;CAM Corujeira Dentro, S3A;POINT(-16.9086129102399 32.6771839533021);0;
1917;576;STA Teresinha, Babosas, D;STA Teresinha, Babosas, D;POINT(-16.9002620779422 32.6695922261706);0;
1914;577;CAM Corujeira Dentro, S2A;CAM Corujeira Dentro, S2A;POINT(-16.9091942187271 32.6791633107677);0;
1060;578;Depois Serragem, Babosas;Depois Serragem, Babosas;POINT(-16.8991044871658 32.6709365897903);0;
1913;578A;R Portada STO Antonio, D;R Portada STO Antonio, D;POINT(-16.8997018446303 32.6705699329881);0;
1903;58;APS Virtudes, D;APS Virtudes, D;POINT(-16.9327987958674 32.6505003140648);0;
1902;580;CAM Lombada, Serragem, D;CAM Lombada, Serragem, D;POINT(-16.899236907553 32.6725658389712);0;
3;1181;Caminho do Terço, D2A;Caminho do Terço, D2A;POINT(-16.8859031861715 32.6647284827971);0;
408;462;Final Rua L STA Luzia;Final Rua L STA Luzia;POINT(-16.9026108011075 32.6604491863813);0;
150;600;CAM Terça, Antigo Término, D;CAM Terça, Antigo Término, D;POINT(-16.9204574612846 32.6766083560211);0;
128;609A;R Portada STO Antonio, S;R Portada STO Antonio, S;POINT(-16.8995967712906 32.6706913633393);0;
2263;784;Saida Bairro Ajuda;Saida Bairro Ajuda;POINT(-16.9347577467229 32.6391345015514);0;
2262;784A;Capela da Ajuda, D;Capela da Ajuda, D;POINT(-16.9392674162423 32.6377848810809);0;
2177;1097;Caminho Casa Velha, S2A;Caminho Casa Velha, S2A;POINT(-16.8900422662959 32.6619031345508);0;
147;597;Levada Corujeira, T-19;Levada Corujeira, T-19;POINT(-16.9144837699295 32.6708407453433);0;
1021;388;Centro Hipico, D;Centro Hipico, D;POINT(-16.8771100556269 32.6667909246323);0;
306;903;Caminho do Areeiro, S;Caminho do Areeiro, S;POINT(-16.9551899055582 32.6450107731197);0;
1727;794;RG-3;RG-3;POINT(-16.9341500614758 32.6429420960248);0;
2008;1171;CAM Novo RIB Santana, S1A;CAM Novo RIB Santana, S1A;POINT(-16.9316214609325 32.6686431030899);0;
2009;1172;Rua João Paulo II, D5A;Rua João Paulo II, D5A;POINT(-16.928731918335 32.641429901123);0;
2010;1173;CAM Novo RIB Santana, S2A;CAM Novo RIB Santana, S2A;POINT(-16.9307331597921 32.6699554016705);0;
2016;1174;Fórum Madeira, D;Fórum Madeira, D;POINT(-16.9438836438042 32.6354048607436);0;
2015;1175;Antes Escola do Galeão;Antes Escola do Galeão;POINT(-16.9299362042076 32.6704645647616);0;
2011;1179;Caminho do Terço, D1A;Caminho do Terço, D1A;POINT(-16.8866021211571 32.6655158959894);0;
2018;118;Galeão, São Roque, D;Galeão, São Roque, D;POINT(-16.9295994677742 32.6714492961005);0;
2038;1182;CAM Lombo Jamboeiro, 41;CAM Lombo Jamboeiro, 41;POINT(-16.9326437898205 32.6728405313341);0;
585;927;R Caridade Pestana, S1A;R Caridade Pestana, S1A;POINT(-16.8764366802466 32.6560233643445);0;
735;579;CAM Corujeira Dentro, S1A;CAM Corujeira Dentro, S1A;POINT(-16.9106294991563 32.678488308484);0;
401;625;CAM Lombo Aguiares, D3A;CAM Lombo Aguiares, D3A;POINT(-16.9416388350507 32.6953520645015);0;
436;390A;CAM São João Latrão, D6A;CAM São João Latrão, D6A;POINT(-16.8806476593018 32.6671333312988);0;
1083;99;CAM Esmeraldo, Dep Moinho;CAM Esmeraldo, Dep Moinho;POINT(-16.9414068713966 32.6542768358122);0;
1059;560;CZ CAM Saltos, D;CZ CAM Saltos, D;POINT(-16.9177303314209 32.6669692993164);0;
1713;802B;Rua Brasil, D1A;Rua Brasil, D1A;POINT(-16.937071957922 32.6475574974707);0;
2431;750E;CAM Trapiche, Entronca, D;CAM Trapiche, Entronca, D;POINT(-16.9481239318848 32.6857986450195);0;
1377;45;Monumental Lido;Monumental Lido;POINT(-16.9312671433111 32.6382421242254);0;
2447;408;Rua Pedro J Ornelas, D1A;Rua Pedro J Ornelas, D1A;POINT(-16.9027690887451 32.6597137451172);0;
1396;328A;Pneuzarco, D;Pneuzarco, D;POINT(-16.8903761617083 32.6700132950293);0;
1624;1046;Caminho do Pasto, D4A;Caminho do Pasto, D4A;POINT(-16.8871811019027 32.6523825756069);0;
411;390;CAM São João Latrão, D7A;CAM São João Latrão, D7A;POINT(-16.8796191073753 32.6672749868096);0;
464;946;CAM Curral Velho ,D2A;CAM Curral Velho ,D2A;POINT(-16.9433010648295 32.67973746967);0;
521;96;Depois Jamboto;Depois Jamboto;POINT(-16.9448690143266 32.6707914112517);0;
1076;981J;Barreira, 91;Barreira, 91;POINT(-16.9490087383696 32.6845055434113);0;
1081;987;CAM Curral Velho, S1A;CAM Curral Velho, S1A;POINT(-16.9437427520752 32.6762084960938);0;
1723;791;Rua DR Pita, Escola;Rua DR Pita, Escola;POINT(-16.9314756598291 32.6472067671013);0;
2317;781C;CAM Trapiche, S3A;CAM Trapiche, S3A;POINT(-16.9467335646838 32.681352813785);0;
2357;709B;CAM Três Paus, Levada, S;CAM Três Paus, Levada, S;POINT(-16.9508374686648 32.6698404777855);0;
2340;710C;Rua Antero Quental;Rua Antero Quental;POINT(-16.9359729318936 32.6656081853148);0;
1648;730;CAM Pilar, QTA Esmeraldo;CAM Pilar, QTA Esmeraldo;POINT(-16.9404383309435 32.6555942287265);0;
495;645A;CAM Agua Mel, ESCL Galeão, S;CAM Agua Mel, ESCL Galeão, S;POINT(-16.9267590248288 32.6699584611207);0;
141;593A;Rua Cesar Rosa;Rua Cesar Rosa;POINT(-16.9160084111657 32.6699788517945);0;
155;6;Quartel General;Quartel General;POINT(-16.9101104736328 32.6468200683594);0;
126;608A;CAM Agua Mel, ESCL Galeão, D;CAM Agua Mel, ESCL Galeão, D;POINT(-16.9269237737232 32.6697295976898);0;
395;621A;CAM Lombo Aguiares, ESCL;CAM Lombo Aguiares, ESCL;POINT(-16.9420679760324 32.6932115651231);0;
382;639;CAM Terça, Poços CMF, S;CAM Terça, Poços CMF, S;POINT(-16.9204313100559 32.6753831807226);0;
1027;38A;CAM E Velho, Madibel, S;CAM E Velho, Madibel, S;POINT(-16.9412326812744 32.6453056335449);0;
431;390F;CAM São João Latrão, D1A;CAM São João Latrão, D1A;POINT(-16.8814400788388 32.6643858617176);0;
442;396;ESCL Palheiro Ferreiro, D;ESCL Palheiro Ferreiro, D;POINT(-16.8654079437256 32.6639556884766);0;
971;673;Viaduto São João, S;Viaduto São João, S;POINT(-16.9183085964922 32.6496385267382);0;
972;673B;ESTR São João, Armazém Sá;ESTR São João, Armazém Sá;POINT(-16.92041015625 32.6535301208496);0;
940;678A;Rua QTA Leme, D1A;Rua QTA Leme, D1A;POINT(-16.9371847509038 32.6613455274822);0;
2402;756;Antes CZ Laranjal;Antes CZ Laranjal;POINT(-16.94320991136 32.6749221309345);0;
2412;764;Rua DR Pita, Coohfal;Rua DR Pita, Coohfal;POINT(-16.9306986144463 32.6472539150669);0;
2331;709E;CAM Três Paus, S2A;CAM Três Paus, S2A;POINT(-16.9541593186795 32.6693222601416);0;
1881;1301;R Padre E Pereira, BC, S;R Padre E Pereira, BC, S;POINT(-16.9298296064581 32.6577901009465);0;
1856;146A;Rua 5 Outubro, Ponte Pau;Rua 5 Outubro, Ponte Pau;POINT(-16.9155535963456 32.6553818940363);0;
1621;10;Hotel Savoy, D;Hotel Savoy, D;POINT(-16.9204597473145 32.6439781188965);0;
1831;1027;R Edmund Betencourt, S1A;R Edmund Betencourt, S1A;POINT(-16.9447156787841 32.6674918777018);0;
1833;1028;Beco da Pinheira, D;Beco da Pinheira, D;POINT(-16.9431887313402 32.6664619665702);0;
1830;1029;R Edmund Betencourt, S2A;R Edmund Betencourt, S2A;POINT(-16.9456853072151 32.6669505539871);0;
1828;103;Antes PAV Trabalhadores;Antes PAV Trabalhadores;POINT(-16.9416020247765 32.6571697028639);0;
1827;1030;Caminho da Ladeira, D1A;Caminho da Ladeira, D1A;POINT(-16.9421376361197 32.6657339754257);0;
1779;1031;R Edmund Betencourt, S3A;R Edmund Betencourt, S3A;POINT(-16.9452005169082 32.6660102951725);0;
124;606;CAM da Igreja Velha, D;CAM da Igreja Velha, D;POINT(-16.9214233294987 32.6711844291307);0;
383;64;Hiper Sá, D;Hiper Sá, D;POINT(-16.9398818266966 32.6498755149479);0;
1077;981I;Escola Boliqueime, S;Escola Boliqueime, S;POINT(-16.949193377407 32.6746989441414);0;
1699;568A;CAM Portada STO Antonio, Ribeiro;CAM Portada STO Antonio, Ribeiro;POINT(-16.9057255947948 32.6708694246577);0;
2369;827;Beriligths, S;Beriligths, S;POINT(-16.9323362330258 32.6379849946507);0;
2322;78;Pico dos Barcelos, D;Pico dos Barcelos, D;POINT(-16.9412838199427 32.6591013786026);0;
2328;709H;CAM Três Paus, S4A;CAM Três Paus, S4A;POINT(-16.9544488595567 32.6713667908664);0;
1618;74;Depois Pavilhão Trabalhadores;Depois Pavilhão Trabalhadores;POINT(-16.9416894283388 32.6575181405503);0;
1369;441;Colegio STA Teresinha, S;Colegio STA Teresinha, S;POINT(-16.904577255249 32.655632019043);0;
2449;1191;Depois Largo Miranda;Depois Largo Miranda;POINT(-16.8895808177244 32.6664350825946);0;
1874;1299;Rua 2 QTA Josefina, S2A;Rua 2 QTA Josefina, S2A;POINT(-16.9293312427785 32.6572589974476);0;
1606;1061;CAM da Cova do Til, S1A;CAM da Cova do Til, S1A;POINT(-16.9558220812536 32.6579759140985);0;
183;1345;Rua Ponta da Cruz, S2A;Rua Ponta da Cruz, S2A;POINT(-16.9466661675753 32.6342885666926);0;
1019;384;CAM dos Pretos, D1A;CAM dos Pretos, D1A;POINT(-16.872674604577 32.6659060452242);0;
458;942;Rua Lazareto,Socateiro, D;Rua Lazareto,Socateiro, D;POINT(-16.8944538269667 32.647456569493);0;
485;953;Cemitério STO Antonio, S;Cemitério STO Antonio, S;POINT(-16.9405844859903 32.6678468190437);0;
2270;359;Largo do Miranda, S;Largo do Miranda, S;POINT(-16.8903505618344 32.6664520939181);0;
1732;802;Rua E U A, Nazaré, D;Rua E U A, Nazaré, D;POINT(-16.937536239624 32.6474456787109);0;
2388;818;CAM Poço Barral,Levada, D;CAM Poço Barral,Levada, D;POINT(-16.9488993428239 32.6557060617289);0;
2395;819D;Travessa Venezuela;Travessa Venezuela;POINT(-16.9367351531982 32.6483535766602);0;
2382;821;Correios da Nazare;Correios da Nazare;POINT(-16.9337256057567 32.6443316158751);0;
2365;826;Albatroz, D;Albatroz, D;POINT(-16.9488581510248 32.6492814335171);0;
2345;709A;CAM Três Paus, Oficina, S;CAM Três Paus, Oficina, S;POINT(-16.9503064584031 32.6692867437943);0;
1850;136;Antes Muro da Coelha;Antes Muro da Coelha;POINT(-16.9234911823527 32.6621881119663);0;
1862;144;Bairro dos Viveiros, D;Bairro dos Viveiros, D;POINT(-16.9191465182511 32.6586946361828);0;
1516;151;Depois Super S Roque;Depois Super S Roque;POINT(-16.9240092558063 32.6721194779933);0;
2056;208;Saida R Caridade Pestana;Saida R Caridade Pestana;POINT(-16.8770187417371 32.655203670111);0;
1704;802E;Rua Brasil, D4A;Rua Brasil, D4A;POINT(-16.9335253283354 32.6451700953249);0;
1703;803;Rua Velha Ajuda, S;Rua Velha Ajuda, S;POINT(-16.9312650611594 32.6388998692219);0;
2309;773;CZ Laranjal, S;CZ Laranjal, S;POINT(-16.9420717393562 32.6753595426664);0;
1435;667;Rua Coronel Sarmento;Rua Coronel Sarmento;POINT(-16.9197608143112 32.6454600443676);0;
1471;433;ESCL Palheiro Ferreiro, S;ESCL Palheiro Ferreiro, S;POINT(-16.8650946385857 32.6643479748767);0;
1381;44;CAM Amparo, Coohafal;CAM Amparo, Coohafal;POINT(-16.9419324064932 32.6484961146142);0;
1415;315;Rua Lazareto, S2A;Rua Lazareto, S2A;POINT(-16.8881473445724 32.6481305152444);0;
1509;1283;Rua Max, S;Rua Max, S;POINT(-16.932424080201 32.6626123823223);0;
1663;1088;CAM ESCL do Galeão, D1A;CAM ESCL do Galeão, D1A;POINT(-16.9289710458911 32.6711145286976);0;
2191;891;CAM das Voltas, Escola;CAM das Voltas, Escola;POINT(-16.89434258054 32.6643985732592);0;
1985;24;Hotel Baia Azul, D;Hotel Baia Azul, D;POINT(-16.9403560411267 32.6363169897469);0;
1987;179;Padaria Marques;Padaria Marques;POINT(-16.913305153483 32.6543072422192);0;
1936;501;Depois CZ L STA Luzia,S;Depois CZ L STA Luzia,S;POINT(-16.9079475402832 32.6616325378418);0;
2002;117;Depois CZ das Courelas, S;Depois CZ das Courelas, S;POINT(-16.9486837593632 32.6669955256101);0;
2017;1176;Escola do Galeão, D;Escola do Galeão, D;POINT(-16.9289180154054 32.6697895755053);0;
153;599A;CAM Portada STO Antonio, S2A;CAM Portada STO Antonio, S2A;POINT(-16.9058001685866 32.671017023711);0;
935;618;CAM Novo Santana, D2;CAM Novo Santana, D2;POINT(-16.9306043053329 32.6665595744159);0;
936;619;CAM Lombo Aguiares, D1A;CAM Lombo Aguiares, D1A;POINT(-16.9419849325229 32.6906227153277);0;
514;957;CAM Cemitério, S;CAM Cemitério, S;POINT(-16.938605985509 32.6702861824192);0;
1086;981F;CAM Barreira, S4A;CAM Barreira, S4A;POINT(-16.9494674116325 32.6826356740034);0;
1371;444A;Antes CZ CAM Comboio, D;Antes CZ CAM Comboio, D;POINT(-16.9092583237617 32.65863991072);0;
1493;333;Rua Murteiras, Padaria, S;Rua Murteiras, Padaria, S;POINT(-16.8883543159371 32.6564628396224);0;
1494;333A;Rua de Santa Isabel, S;Rua de Santa Isabel, S;POINT(-16.8881956834657 32.6569817807588);0;
553;341;Travessa do Pomar, D2A;Travessa do Pomar, D2A;POINT(-16.8874359890427 32.662665935571);0;
1840;345;Rua Azevedo Meneses, S1A;Rua Azevedo Meneses, S1A;POINT(-16.8942313922505 32.6594593904578);0;
1572;353;CAM Voltas, Escola, S;CAM Voltas, Escola, S;POINT(-16.894184824951 32.6651360214359);0;
1577;355;Curva João Ladrão, S;Curva João Ladrão, S;POINT(-16.8926770463393 32.6651224505724);0;
1852;13A;AV Mar, Alfandega;AV Mar, Alfandega;POINT(-16.9059226452107 32.6471405000887);0;
2187;1120;Depois Escola do Galeão;Depois Escola do Galeão;POINT(-16.9298757887689 32.6704738186265);0;
1610;971;Monte-Lajinhas;Monte-Lajinhas;POINT(-16.9005820589951 32.6790860429995);0;
1044;910;CAM Terra Chã, Beco, D;CAM Terra Chã, Beco, D;POINT(-16.9401900875296 32.6651261178349);0;
446;394;Campo Futebol 1-Maio, D;Campo Futebol 1-Maio, D;POINT(-16.8658455876225 32.6657956603587);0;
419;85;CAM Virtudes, S;CAM Virtudes, S;POINT(-16.9316880934885 32.6508893890519);0;
461;949A;CAM Terra Chã, ESCL, S;CAM Terra Chã, ESCL, S;POINT(-16.9404995646924 32.6661217507768);0;
519;959;CAM Velho Quinta, S1A;CAM Velho Quinta, S1A;POINT(-16.9260863698032 32.6633670553268);0;
515;961;CAM Velho da Quinta, S2A;CAM Velho da Quinta, S2A;POINT(-16.9256460601384 32.6647044727833);0;
315;909A;Chamorra, T-10 Vasco Gil;Chamorra, T-10 Vasco Gil;POINT(-16.9521644043157 32.6836849767646);0;
2283;124;Antes Encontro S Roque;Antes Encontro S Roque;POINT(-16.9241347221061 32.6719073516105);0;
2282;1259;Caminho da Quinta, S6A;Caminho da Quinta, S6A;POINT(-16.9261645899606 32.6623386367656);0;
1692;873;Caminho da Lombada, S;Caminho da Lombada, S;POINT(-16.9645723442042 32.649930333511);0;
131;614;ESCL Francisco Franco, D;ESCL Francisco Franco, D;POINT(-16.904586674163 32.652607636325);0;
1043;910A;Antigo Centro Saude STO Antonio;Antigo Centro Saude STO Antonio;POINT(-16.9394490151817 32.6642062028794);0;
1747;554;Chão Marcos, Corj Fora, D;Chão Marcos, Corj Fora, D;POINT(-16.9109470315639 32.676648276113);0;
1701;881;Campo do Maritimo, S;Campo do Maritimo, S;POINT(-16.9361724853516 32.6715774536133);0;
2330;709F;CAM Três Paus, Viana, S;CAM Três Paus, Viana, S;POINT(-16.9554354227478 32.6690646860865);0;
1625;1052;Largo TV do Pomar, D;Largo TV do Pomar, D;POINT(-16.8892818748317 32.6637131732983);0;
1597;1076;TV Campo do Maritimo, D;TV Campo do Maritimo, D;POINT(-16.9368257922751 32.6697275716207);0;
2163;1119;R DR Caroço, BC Frias, S;R DR Caroço, BC Frias, S;POINT(-16.918261869905 32.6511161744982);0;
2160;111B;Depois Capela Preces;Depois Capela Preces;POINT(-16.9495109626163 32.6644726161848);0;
2470;1367;R Pedra Sina, Depois Sociedade;R Pedra Sina, Depois Sociedade;POINT(-16.8876391585879 32.6543736222639);0;
2239;1307;R DR Pita-Clube Tenis;R DR Pita-Clube Tenis;POINT(-16.9271377274304 32.645780612728);0;
2228;919;Cemitério São Gonçalo, S;Cemitério São Gonçalo, S;POINT(-16.8821429455416 32.6504027479361);0;
168;1266;Caminho dos Tornos, D3A;Caminho dos Tornos, D3A;POINT(-16.9116191864014 32.6749496459961);0;
1317;1246;Caminho Pico Funcho, 1A;Caminho Pico Funcho, 1A;POINT(-16.9493159228775 32.6551248758765);0;
1343;285;Rua da Rochinha;Rua da Rochinha;POINT(-16.9009829196741 32.6519483929789);0;
251;1273;QTA Rocha, T-40 ;QTA Rocha, T-40 ;POINT(-16.879231350783 32.6476068850081);0;
1531;1194;Caminho da Quinta, D3A;Caminho da Quinta, D3A;POINT(-16.9259460903279 32.6615354494832);0;
1557;1196;Caminho da Quinta, D4A;Caminho da Quinta, D4A;POINT(-16.9249679228379 32.661192439196);0;
2181;1104;R Palheiro Ferreiro, D1A;R Palheiro Ferreiro, D1A;POINT(-16.8594086131985 32.6652104880255);0;
2168;1105;Rua da Boa Nova, S;Rua da Boa Nova, S;POINT(-16.8810806274414 32.6582412719727);0;
2154;1108;R Palheiro Ferreiro,LG, D;R Palheiro Ferreiro,LG, D;POINT(-16.8626669996094 32.6649858863751);0;
173;1264;Caminho dos Tornos, D2A;Caminho dos Tornos, D2A;POINT(-16.9133017504602 32.676567906807);0;
